id,info_text,info_text
zweitwohnungsgesetz,"Das eidg. Zweitwohnungsgesetz (ZWG) gelangt in verschiedenen Gemeinden zur Anwendung (vgl. [Karte](https://map.geo.admin.ch/?topic=ech&lang=de&bgLayer=ch.swisstopo.pixelkarte-farbe&layers=ch.swisstopo.zeitreihen,ch.bfs.gebaeude_wohnungs_register,ch.bav.haltestellen-oev,ch.swisstopo.swisstlm3d-wanderwege,ch.are.wohnungsinventar-zweitwohnungsanteil&layers_visibility=false,false,false,false,true&layers_timestamp=18641231,,,,&layers_opacity=1,1,1,1,0.75&E=2785394.25&N=1180381.63&zoom=2)). In diesen Gemeinden ist der Neubau von Zweitwohnungen nicht zulässig. Bauwillige haben daher mit dem Baugesuch bekannt zu geben, ob bzw. welche Wohnungen touristisch bewirtschaftet werden und welche Wohnungen als Erstwohnung oder als einer Erstwohnung gleichgestellten Wohnung genutzt werden sollen. 

Diese Angaben sind in einem Plan zu verorten oder in einem Wohnungsspiegel zu bezeichnen.","La legge sulle abitazioni secondarie (LASec) viene applicata in diversi comuni (cfr. [cartina](https://map.geo.admin.ch/?topic=ech&lang=it&bgLayer=ch.swisstopo.pixelkarte-farbe&layers=ch.swisstopo.zeitreihen,ch.bfs.gebaeude_wohnungs_register,ch.bav.haltestellen-oev,ch.swisstopo.swisstlm3d-wanderwege,ch.are.wohnungsinventar-zweitwohnungsanteil&layers_visibility=false,false,false,false,true&layers_timestamp=18641231,,,,&layers_opacity=1,1,1,1,0.75&E=2785394.25&N=1180381.63&zoom=2). In questi comuni non è ammessa la nuova costruzione di abitazioni secondarie. Con la domanda di costruzione chi intende costruire deve dunque comunicare se e quali abitazioni vengono gestite a scopi turistici e quali abitazioni vengono invece utilizzate come abitazioni primarie oppure come abitazioni equiparate alle abitazioni primarie. 

Queste indicazioni devono essere inserite in un piano o in una tabella delle abitazioni."
zwg,"####INFO

In den Gemeinden, in denen der Anteil von Zweitwohnungen gemäss ZWG mehr als 20% beträgt, müssen die Wohnungen entsprechend der Nutzung anhand dieser Auswahl mit oder ohne im Grundbuch eingetragene Nutzungsbeschränkung gemäss ZWG, klassiert werden.","####INFO

Nei comuni in cui la quota di abitazioni secondarie conformemente alla LASec supera il 20%, le abitazioni devono essere classificate in base al loro utilizzo secondo la presente selezione con o senza limitazione d'uso iscritta a registro fondiario conformemente alla LASec."
baurecht-nummer,"Informationsfenster
Das Baurecht beinhaltet das Recht, Bauten auf fremdem Boden zu errichten und fortbestehen zu lassen. Das Baurecht durchbricht das sog. Akzessionsprinzip, wonach Bauten immer Bestandteil des Grundstückes bilden.","Finestra informativa
Il diritto di superficie comprende il diritto di realizzare e mantenere delle costruzioni su terreni di terzi. Il diritto di superficie prevale sul cosiddetto diritto dell'accessione secondo cui le costruzioni sono sempre parte integrante del fondo."
e-grid-nr,Eidgenössische Grundstücksidentifikationsnummer,Identificatore federale dei fondi
folgeplanung,"Im Zonenplan können Gebiete bezeichnet werden, in denen eine Folgeplanung (Arealplanung, Quartierplanung) durchgeführt wird. 

Die Festlegung einer Folgeplanung hat für das betroffene Gebiet die Wirkung einer Planungszone.

Diese Informationen werden direkt aus dem GIS abgefüllt.","Nel piano delle zone si possono indicare delle aree in cui avviene una pianificazione consecutiva (piano di area, piano di quartiere). 

Per l'area interessata la determinazione di una pianificazione consecutiva ha gli effetti di una zona di pianificazione.

Queste informazioni vengono inserire direttamente dal SIG."
genereller-erschliessungsplan,"Der Generelle Erschliessungsplan legt in den Grundzügen die Verkehrs-, Versorgungs- und Entsorgungsanlagen zur Erschliessung der Bauzonen und anderer Nutzungszonen fest. Er enthält mindestens die Anlagen der Grund- und Groberschliessung und kann auch Anlagen der Feinerschliessung umfassen.

Diese Informationen werden direkt aus dem GIS abgefüllt.","Il piano generale di urbanizzazione definisce nei tratti fondamentali gli impianti per il traffico, di approvvigionamento e di smaltimento per l'urbanizzazione delle zone edificabili e di altre zone di utilizzazione. Esso contiene almeno gli impianti dell'urbanizzazione di base e generale e può anche comprendere gli impianti dell'urbanizzazione particolare.

Queste informazioni vengono inserire direttamente dal SIG."
genereller-gestaltungsplan,"Der Generelle Gestaltungsplan ordnet in den Grundzügen die Gestaltung (Erhaltung, Erneuerung, Weiterentwicklung) der Siedlungen und der Landschaft.


Diese Informationen werden direkt aus dem GIS abgefüllt.","Il piano generale delle strutture disciplina nei tratti fondamentali la strutturazione (conservazione, rinnovo, sviluppo ulteriore) degli insediamenti e del paesaggio.


Queste informazioni vengono inserire direttamente dal SIG."
gis-map,"Bitte tragen Sie die Adresse Ihres Bauvorhabens in die Zeile ein oder klicken Sie in die nachfolgende Karte um die Lage des Bauvorhabens in der Karte zu verorten. 

Sie können ein Punkt, eine Linie oder eine Fläche in der Karte zeichnen.","Indicare l'indirizzo del progetto di costruzione nella riga o cliccare sulla cartina successiva per indicare la posizione esatta del progetto. 

Sulla cartina è possibile disegnare un punto, una linea o una superficie."
juristische-person-gesuchstellerin,"In der Schweiz ist eine juristische Person eine rechtliche Entität, wie eine Firma, eine Stiftung oder eine Vereinigung, die vom Gesetz anerkannt ist und eigenständig Rechte und Pflichten wahrnehmen kann, unabhängig von den Personen, die sie gründen oder kontrollieren.","In Svizzera una persona giuridica è un'entità giuridica come una ditta, una fondazione o un'associazione riconosciuta dalla legge e in grado di assumere autonomamente diritti e doveri, indipendentemente dalle persone che le costituiscono e le controllano."
parzellennummer,Parzelle: Durch Vermessung festgelegtes Grundstück (bzw. Grundstücksteil).,Particella: fondo (o parte di un fondo) determinato con la misurazione.
personalien-gesuchstellerin,"Nach Art. 89 Abs. 3 des kantonalen Raumplanungsgesetzes (KRG) ist das Baugesuch zwingend durch die Bauherrschaft zu unterzeichnen. 

Ist die Bauherrschaft nicht Eigentümerin der Liegenschaft, ist das Baugesuch durch die Eigentümerin oder den Eigentümer mitzuunterzeichnen.

Die Unterschriften werden am Schluss des Eingabeprozesses auf die Eingabequittung, die auszudrucken ist, gesetzt.","Secondo l'art. 89 cpv. 3 della legge sulla pianificazione territoriale cantonale (LPTC) la committenza deve necessariamente firmare la domanda di costruzione. 

Se la committenza non è proprietaria dell'immobile, la domanda di costruzione deve essere controfirmata dalla persona proprietaria.

Le firme vengono poste al termine del processo di inserimento sulla ricevuta che deve essere stampata."
profil-uebernehmen,"Sie haben die Möglichkeit, automatisch die Informationen aus ihrem [Benutzerprofil](/auth/realms/ebau/account?referrer=portal#/personal-info) ins Formular zu übernehmen.",Ha la possibilità di riprendere automaticamente le informazioni del suo [profilo utente](/auth/realms/ebau/account?referrer=portal#/personal-info) nel modulo.
weitere-personen,Mit der Vollmacht handeln Sie in Stellvertretung für Dritte. Hinweise über die Regelungen der Stellvertretung finden Sie in Art. 32-40 des eidg. Obligationenrecht (OR).,La procura permette di agire in rappresentanza di terzi. Indicazioni relative alle regolamentazioni della rappresentanza si possono trovare negli art. 32-40 del diritto federale delle obbligazioni (CO).
zonenplan,"Der Zonenplan unterteilt das Gemeindegebiet in verschiedene Nutzungszonen (Bauzonen, Landwirtschaftszonen, Schutzzonen und weitere Zonen). 

Die Zonen der Grundnutzung bestimmen allgemein die zulässige Nutzung des Bodens. Die Zonen überlagerter Nutzung enthalten ergänzende Nutzungsvorschriften.

Diese Informationen werden direkt aus dem GIS abgefüllt.","Il piano delle zone suddivide il territorio comunale in diverse zone di utilizzazione (zone edificabili, zone agricole, zone di protezione e altre zone). 

Le zone di utilizzazione di base determinano in modo generale l'utilizzazione ammissibile del territorio. Le zone di utilizzazione multipla contengono prescrizioni di utilizzazione complementari.

Queste informazioni vengono inserire direttamente dal SIG."
